<?xml version="1.0" encoding="utf-8"?>
<!DOCTYPE ttm PUBLIC "-//Tablix//DTD TTM 0.2.0//EN" "http://www.tablix.org/releases/dtd/tablix2r1.dtd">

<ttm version="0.2.0">
  <info>
    <title>Room availabilty module test</title>
    <address>www.yandex.ru</address>
    <author>Max Lapan</author>
  </info>
  <modules>
    <module name="available" weight="200" mandatory="yes"/>
    <module name="timeplace" weight="500" mandatory="yes"/>
    <module name="sametimelight" weight="500" mandatory="yes"/>
    <module name="room_available" weight="500" mandatory="yes"/>
    <module name="nights" weight="500" mandatory="yes">
      <option name="max-nights-per-week">2</option>
      <option name="max-nights-weight">100</option>
    </module>
    <module name="time_descriptions" weight="0" mandatory="no">
      <option name="output">time_descr.txt</option>
    </module>
    <module name="shift" weight="500" mandatory="yes">
      <option name="hours">8</option>
      <option name="distance">8</option>
    </module>
  </modules>

  <resources>
    <constant>
      <resourcetype type="operator">
        <resource name="airdog">
          <restriction type="allow-near-shifts">1</restriction>
        </resource>
        <resource name="alex27j"></resource>
        <resource name="astronom"></resource>
        <resource name="shpin"></resource>
        <resource name="teran">
        </resource>
        <resource name="shmuma"></resource>
      </resourcetype>
    </constant>

    <variable>
      <resourcetype type="time">
        <matrix width="7" height="3"/>
      </resourcetype>

      <resourcetype type="room">
        <resource name="Vavilova">
          <restriction type="room-not-available-time">0</restriction>
          <restriction type="room-not-available-day">5</restriction>
          <restriction type="room-not-available-day">6</restriction>
          <restriction type="time-descriptions">23:00,07:00,15:00</restriction>
        </resource>
        <resource name="ETO">
          <restriction type="room-not-available-cell">1 2</restriction>
          <restriction type="time-descriptions">23:00,07:00,15:00</restriction>
        </resource>
      </resourcetype>
    </variable>
  </resources>

  <events>
    <event name="Work" repeats="5">
        <resource type="operator" name="airdog"/>
    </event>
    <event name="Work" repeats="5">
        <resource type="operator" name="alex27j"/>
    </event>
    <event name="Work" repeats="5">
        <resource type="operator" name="astronom"/>
    </event>
    <event name="Work" repeats="5">
        <resource type="operator" name="shpin"/>
    </event>
    <event name="Work" repeats="5">
        <resource type="operator" name="teran"/>
    </event>
  </events>
</ttm>
