<?xml version="1.0" encoding="utf-8"?>
<!DOCTYPE ttm PUBLIC "-//Tablix//DTD TTM 0.2.0//EN" "http://www.tablix.org/releases/dtd/tablix2r1.dtd">

<ttm version="0.2.0">
  <info>
    <title>User's preferences module test</title>
    <address>www.yandex.ru</address>
    <author>Max Lapan</author>
  </info>
  <modules>
    <module name="available" weight="200" mandatory="yes"/>
    <module name="timeplace" weight="500" mandatory="yes"/>
    <module name="sametimelight" weight="500" mandatory="yes"/>
    <module name="room_available" weight="500" mandatory="yes">
      <option name="debug">0</option>
    </module>
    <module name="preference" weight="50" mandatory="no"/>
    <module name="time_descriptions" weight="0" mandatory="no">
      <option name="output">time_descr.txt</option>
    </module>
  </modules>

  <resources>
    <constant>
      <resourcetype type="operator">
        <resource name="airdog"></resource>
        <resource name="alex27j"></resource>
        <resource name="astronom"></resource>
        <resource name="shpin">
          <restriction type="pref-room">!2 ETO</restriction>
          <restriction type="pref-room">1 Golem</restriction>
        </resource>
        <resource name="teran">
          <restriction type="pref-room">2 ETO</restriction>
          <restriction type="pref-room">2 Vavilova</restriction>
          <restriction type="pref-time-day">!2 0</restriction>
          <restriction type="pref-time-time">!2 0</restriction>
          <restriction type="pref-time-cell">!2 1 2</restriction>
        </resource>
        <resource name="shmuma">
          <restriction type="pref-room">1 Vavilova</restriction>
          <restriction type="pref-room">!1 ETO</restriction>
        </resource>
      </resourcetype>
    </constant>

    <variable>
      <resourcetype type="time">
        <matrix width="7" height="3"/>
      </resourcetype>

      <resourcetype type="room">
        <resource name="Vavilova">
          <restriction type="time-descriptions">23:00,07:00,15:00</restriction>
          <restriction type="room-not-available-time">0</restriction>
          <restriction type="room-not-available-day">5</restriction>
          <restriction type="room-not-available-day">6</restriction>
        </resource>
        <resource name="ETO">
          <restriction type="time-descriptions">23:00,07:00,15:00</restriction>
          <restriction type="room-must-be-filled">0</restriction>
          <restriction type="room-must-be-filled">1</restriction>
          <restriction type="room-must-be-filled">2</restriction>
          <restriction type="room-not-available-cell">1 2</restriction>
          <restriction type="room-not-available-day">5</restriction>
        </resource>
        <resource name="Golem">
          <restriction type="room-must-be-filled">0</restriction>
          <restriction type="room-must-be-filled">1</restriction>
          <restriction type="time-descriptions">23:00,07:00,15:00</restriction>
        </resource>
      </resourcetype>
    </variable>
  </resources>

  <events>
    <event name="Work" repeats="4">
        <resource type="operator" name="airdog"/>
    </event>
    <event name="Work" repeats="4">
        <resource type="operator" name="alex27j"/>
    </event>
    <event name="Work" repeats="4">
        <resource type="operator" name="astronom"/>
    </event>
    <event name="Work" repeats="4">
        <resource type="operator" name="shpin"/>
    </event>
    <event name="Work" repeats="10">
        <resource type="operator" name="teran"/>
    </event>
    <event name="Work" repeats="10">
        <resource type="operator" name="shmuma"/>
    </event>
  </events>
</ttm>
