<?xml version="1.0" encoding="utf-8"?>
<!DOCTYPE ttm PUBLIC "-//Tablix//DTD TTM 0.2.0//EN" "http://www.tablix.org/releases/dtd/tablix2r1.dtd">
<ttm version="0.2.0" fitness="0">
  <info>
    <title>Shifts sanity module test</title>
    <address>www.yandex.ru</address>
    <author>Max Lapan</author>
  </info>
  <modules>
    <module name="available" weight="200" mandatory="yes"/>
    <module name="timeplace" weight="500" mandatory="yes"/>
    <module name="sametimelight" weight="500" mandatory="yes"/>
    <module name="shifts" weight="500" mandatory="yes">
      <option name="max-nights-per-week">2</option>
      <option name="max-nights-weight">100</option>
    </module>
  </modules>

  <resources>
    <constant>
      <resourcetype type="operator" typeid="0">
        <resource name="airdog" resid="0"/>
        <resource name="alex27j" resid="1"/>
        <resource name="astronom" resid="2"/>
        <resource name="shpin" resid="3"/>
        <resource name="teran" resid="4"/>
        <resource name="shmuma" resid="5"/>
      </resourcetype>
    </constant>

    <variable>
      <resourcetype type="time" typeid="1">
        <matrix width="7" height="3" resid-from="0" resid-to="20"/>
      </resourcetype>

      <resourcetype type="room" typeid="2">
        <resource name="Vavilova" resid="0">
        </resource>
        <resource name="ETO" resid="1">
        </resource>
      </resourcetype>
    </variable>
  </resources>

  <events>
    <event name="Work" repeats="1" tupleid="0">
        <resource type="operator" name="airdog"/>
    	<resource type="time" name="4 2"/>
			<resource type="room" name="ETO"/>
		</event><event name="Work" repeats="1" tupleid="1">
        <resource type="operator" name="airdog"/>
    	<resource type="time" name="1 2"/>
			<resource type="room" name="Vavilova"/>
		</event><event name="Work" repeats="1" tupleid="2">
        <resource type="operator" name="airdog"/>
    	<resource type="time" name="2 1"/>
			<resource type="room" name="Vavilova"/>
		</event><event name="Work" repeats="1" tupleid="3">
        <resource type="operator" name="airdog"/>
    	<resource type="time" name="2 0"/>
			<resource type="room" name="ETO"/>
		</event><event name="Work" repeats="1" tupleid="4">
        <resource type="operator" name="airdog"/>
    	<resource type="time" name="5 0"/>
			<resource type="room" name="ETO"/>
		</event>
    <event name="Work" repeats="1" tupleid="5">
        <resource type="operator" name="alex27j"/>
    	<resource type="time" name="5 1"/>
			<resource type="room" name="ETO"/>
		</event><event name="Work" repeats="1" tupleid="6">
        <resource type="operator" name="alex27j"/>
    	<resource type="time" name="6 0"/>
			<resource type="room" name="Vavilova"/>
		</event><event name="Work" repeats="1" tupleid="7">
        <resource type="operator" name="alex27j"/>
    	<resource type="time" name="4 1"/>
			<resource type="room" name="ETO"/>
		</event><event name="Work" repeats="1" tupleid="8">
        <resource type="operator" name="alex27j"/>
    	<resource type="time" name="4 2"/>
			<resource type="room" name="Vavilova"/>
		</event><event name="Work" repeats="1" tupleid="9">
        <resource type="operator" name="alex27j"/>
    	<resource type="time" name="0 0"/>
			<resource type="room" name="Vavilova"/>
		</event>
    <event name="Work" repeats="1" tupleid="10">
        <resource type="operator" name="astronom"/>
    	<resource type="time" name="3 0"/>
			<resource type="room" name="Vavilova"/>
		</event><event name="Work" repeats="1" tupleid="11">
        <resource type="operator" name="astronom"/>
    	<resource type="time" name="3 2"/>
			<resource type="room" name="Vavilova"/>
		</event><event name="Work" repeats="1" tupleid="12">
        <resource type="operator" name="astronom"/>
    	<resource type="time" name="2 2"/>
			<resource type="room" name="Vavilova"/>
		</event><event name="Work" repeats="1" tupleid="13">
        <resource type="operator" name="astronom"/>
    	<resource type="time" name="3 1"/>
			<resource type="room" name="Vavilova"/>
		</event><event name="Work" repeats="1" tupleid="14">
        <resource type="operator" name="astronom"/>
    	<resource type="time" name="0 0"/>
			<resource type="room" name="ETO"/>
		</event>
    <event name="Work" repeats="1" tupleid="15">
        <resource type="operator" name="shpin"/>
    	<resource type="time" name="0 1"/>
			<resource type="room" name="Vavilova"/>
		</event><event name="Work" repeats="1" tupleid="16">
        <resource type="operator" name="shpin"/>
    	<resource type="time" name="1 1"/>
			<resource type="room" name="Vavilova"/>
		</event><event name="Work" repeats="1" tupleid="17">
        <resource type="operator" name="shpin"/>
    	<resource type="time" name="3 2"/>
			<resource type="room" name="ETO"/>
		</event><event name="Work" repeats="1" tupleid="18">
        <resource type="operator" name="shpin"/>
    	<resource type="time" name="4 0"/>
			<resource type="room" name="Vavilova"/>
		</event><event name="Work" repeats="1" tupleid="19">
        <resource type="operator" name="shpin"/>
    	<resource type="time" name="6 2"/>
			<resource type="room" name="Vavilova"/>
		</event>
    <event name="Work" repeats="1" tupleid="20">
        <resource type="operator" name="teran"/>
    	<resource type="time" name="0 1"/>
			<resource type="room" name="ETO"/>
		</event><event name="Work" repeats="1" tupleid="21">
        <resource type="operator" name="teran"/>
    	<resource type="time" name="4 0"/>
			<resource type="room" name="ETO"/>
		</event><event name="Work" repeats="1" tupleid="22">
        <resource type="operator" name="teran"/>
    	<resource type="time" name="2 0"/>
			<resource type="room" name="Vavilova"/>
		</event><event name="Work" repeats="1" tupleid="23">
        <resource type="operator" name="teran"/>
    	<resource type="time" name="3 1"/>
			<resource type="room" name="ETO"/>
		</event><event name="Work" repeats="1" tupleid="24">
        <resource type="operator" name="teran"/>
    	<resource type="time" name="2 2"/>
			<resource type="room" name="ETO"/>
		</event>
    <event name="Work" repeats="1" tupleid="25">
        <resource type="operator" name="shmuma"/>
    	<resource type="time" name="0 2"/>
			<resource type="room" name="Vavilova"/>
		</event><event name="Work" repeats="1" tupleid="26">
        <resource type="operator" name="shmuma"/>
    	<resource type="time" name="1 0"/>
			<resource type="room" name="Vavilova"/>
		</event><event name="Work" repeats="1" tupleid="27">
        <resource type="operator" name="shmuma"/>
    	<resource type="time" name="5 2"/>
			<resource type="room" name="Vavilova"/>
		</event><event name="Work" repeats="1" tupleid="28">
        <resource type="operator" name="shmuma"/>
    	<resource type="time" name="6 0"/>
			<resource type="room" name="ETO"/>
		</event><event name="Work" repeats="1" tupleid="29">
        <resource type="operator" name="shmuma"/>
    	<resource type="time" name="1 1"/>
			<resource type="room" name="ETO"/>
		</event><event name="Work" repeats="1" tupleid="30">
        <resource type="operator" name="shmuma"/>
    	<resource type="time" name="5 1"/>
			<resource type="room" name="Vavilova"/>
		</event><event name="Work" repeats="1" tupleid="31">
        <resource type="operator" name="shmuma"/>
    	<resource type="time" name="6 1"/>
			<resource type="room" name="Vavilova"/>
		</event><event name="Work" repeats="1" tupleid="32">
        <resource type="operator" name="shmuma"/>
    	<resource type="time" name="2 1"/>
			<resource type="room" name="ETO"/>
		</event><event name="Work" repeats="1" tupleid="33">
        <resource type="operator" name="shmuma"/>
    	<resource type="time" name="4 1"/>
			<resource type="room" name="Vavilova"/>
		</event><event name="Work" repeats="1" tupleid="34">
        <resource type="operator" name="shmuma"/>
    	<resource type="time" name="1 2"/>
			<resource type="room" name="ETO"/>
		</event>
  </events>
</ttm>
<!-- End of file -->
<!-- End of file -->
